{
  "case_id": "t2_retention_001",
  "credibility_level": "CL0",
  "evidence_of": "T2 virtual-bench foundation for HW-SF-002 (H-07, issue #53): Renode platform model (hw/virtual-bench/renode/), deterministic FMI 2.0 co-simulation bridge (hw/virtual-bench/fmi_bridge.py) and orchestration (this file). No T2 run has been executed: this manifest records the pending disposition of the retention sequence (retention write < safe latch < IWDG fire) pending the first Renode-equipped run of the v1.0.0 firmware ELF.",
  "firmware": {
    "elf": "built off-tree from tag v1.0.0 with the pinned toolchain image (virtual-bench-plan section 2); supplied at run time via CANCESTRY_T2_ELF; never committed; its sha256 is recorded in the evidence at run time",
    "modification": "none; the firmware is read-only (issue #53)"
  },
  "inherited_validation_gap": "openmodelica: Compiler semantics outside independently validated output remain unqualified; OR-001/OR-002 regressions do not cover all translation and solver behavior.",
  "not_covered": [
    "No executed T2 run exists: no event timestamps, no trace hash and no ELF/FMU artifact hashes are claimed by this manifest.",
    "QA-EV-01 escalation stimulus injection (the queue-saturation fault recipe reaching the firmware through CAN traffic) is not part of this foundation; capture is passive and the runner fails closed if the sequence does not occur within 150 ms.",
    "BOR/power-supervisor reset on brownout is not_simulated in the platform model (HwAGENTS.md rule 6: safety-relevant, Human Reviewer-gated); the brownout energy margin itself is closed at T1 by OR-001 (holdup_001).",
    "DWT CYCCNT accuracy is not exercised by the ordering claim (events are captured from emulation virtual time); it carries the renode validation gap.",
    "CAN protocol simulation, thermal simulation and multi-channel support are out of H-07 scope (issue #53 constraints).",
    "T4 physical correlation: bench-pending per HwRS section 5; CL3 requires bench data (no qualification promotion)."
  ],
  "oracle_id": "OR-001",
  "pass": false,
  "pending_reason": "The T2 toolchain (pinned Renode 1.16 + the off-tree v1.0.0 firmware ELF) is now provisioned by the hw-nightly t2-virtual-bench job (issue #55, H-08), but no executed T2 run backs this artifact yet, so the retention sequence (retention write < safe latch < IWDG fire) remains sim-pending. Foundation delivered by https://github.com/mfreazer/CANcestry-/issues/53; the first executing run is produced by hw/virtual-bench/run_t2_retention.py on the T2 toolchain image and must reproduce this ledger chain deterministically before any passing claim.",
  "provisional": true,
  "requirement_id": "HW-SF-002",
  "scenario": {
    "duration_us": 150000,
    "fmu_step_us": 1,
    "master_step_us": 100,
    "method": "virtual_bench",
    "seed": "123456789"
  },
  "schema_version": "0.1.0",
  "sim_case": "hw/tests/cases/holdup_001.simcase.json",
  "source_hashes": {
    "ci/docker/Dockerfile": "sha256:49703d8b330e41c58e5411bdede3310aec55199e3fb77fc973189b9ee7358102",
    "ci/docker/Dockerfile.t2": "sha256:79b533163dc4919f4cd45f9581c0a119a150b15efde6061e5747160a2c09cf85",
    "ci/docker/base-image.digest": "sha256:fbe0594ac4ef88a211f86be44892d6d24efaefd22b747fe6aca41f512e38614f",
    "ci/docker/renode-1.16.1.pin": "sha256:091ef14d0677440408bc2436530442e4fea1690439b1827a7bd08d495c6b44f1",
    "docs/hw/tool-qualification.md": "sha256:51509f080b4b114345a6285c01e9275a86e9d324c0aa27ffe6425fdfaf78ff53",
    "docs/hw/virtual-bench-plan.md": "sha256:8d5a3f5d07730c9d63090d740bf17466979d913174b3c6c8b9032700f86c84fe",
    "hw/model/CancestryLib/Power/Holdup.mo": "sha256:20af059a03aa6537bbf462fe3b1873ae7dd7a5faa9daca0cbf92fdf4322946b4",
    "hw/model/CancestryLib/Power/package.mo": "sha256:b764dcccf84d3660c855d2d9712ed63bf7ff3e617a7409fd72d4381a0d527c33",
    "hw/model/CancestryLib/package.mo": "sha256:53662fe968facb4cc3ca5d6ccb0ec8a7b7382224c0122ab5af19b748694e2372",
    "hw/tests/cases/holdup_001.simcase.json": "sha256:6c1da1b50d8d3486c17f06a96cf49a5663e1486cc4344e67ab44282b176f0ae1",
    "hw/tests/oracles/or_001_holdup.py": "sha256:0be9fe0869c355a9780f73d17981f92dba4af1bbfc2b1be392930402a5f63b9d",
    "hw/tests/oracles/registry.csv": "sha256:7e478f80772bf29e09b02981684e06784646adb7459fe95afd38982d8836a6ba",
    "hw/tests/oracles/registry.json": "sha256:9480431021cb56920a3236968accebf60b98a6ef0ac5835957cd471538b00345",
    "hw/virtual-bench/firmware/build_firmware.sh": "sha256:b600a2ec5e6e92533617ccf1c7acc12cd54510b09768b24763b7ac4c6fa1833a",
    "hw/virtual-bench/firmware/main.c": "sha256:10a805faa0a84af388c58aac215f31e2de8e0b929ea5f7c6db19acad8a5f9d9d",
    "hw/virtual-bench/firmware/startup.s": "sha256:8182c84a3c7028723006271fa0678f8c54bd0040d0476fc3ee2d93ca1e9e5606",
    "hw/virtual-bench/firmware/t2_target_compat.h": "sha256:a3b0c72c96bbc475e63a13e9f9c5003f7cf42d102fe959d6b0cc56b5c26555d1",
    "hw/virtual-bench/fmi2_smoke_slave.c": "sha256:621f65454471412ac79ed90fbb67025ea44ada1bbb1b41c3c995dc4fbfed26d7",
    "hw/virtual-bench/fmi_bridge.py": "sha256:d1ddfeea57ab68df5ec1f0e4fcfc75faa3f9ef4a5bac5e9b93ae9bf138d0b13d",
    "hw/virtual-bench/fmi_bridge_test.py": "sha256:16b11fd0fd1e6f5f746dadb362bd4492ad262c09bad4e20da10a68c1e5f2856e",
    "hw/virtual-bench/renode/cancestry-hw.resc": "sha256:438b4f5e73a2997ea7afeab16f0838268f6e4649584047df21f073bd59ac62dd",
    "hw/virtual-bench/renode/gpioa_model.py": "sha256:a05b2b47e3f08ba411ebdcc41689f19b934fe40e9746d0cfcdb3c55b75c5f37a",
    "hw/virtual-bench/renode/iwdg_model.py": "sha256:91267b1ce23e020f5cf3fd1846b10a52702c8a999c4ac79e25be8bb0dbc0710f",
    "hw/virtual-bench/renode/rcc_model.py": "sha256:3a95d26a649567d8e38685435d29c62549320d258235dbe18fe042c9c87ea9ce",
    "hw/virtual-bench/renode/rtc_backup_model.py": "sha256:6527fe2ec7ebdfe715648846016eaf1728b4362c6aeaa7e6fe3c7c8b87d1adfe",
    "hw/virtual-bench/renode/stm32g474-cancestry.repl": "sha256:e053936126b57e89a6cac779ea43aa41755f04a1418e1fd4d9c6a58985913f04",
    "hw/virtual-bench/run_t2_retention.py": "sha256:150a3eccfcadaac77c3623db58f4923bb038169d9b8599cf117889dc59d3854f",
    "hw/virtual-bench/test_t2_retention.py": "sha256:bf6fe23010983282613dfdb869641c4d84c139440af3ab25dcfecb77dc6633f0",
    "schemas/hw/hw-oracle-registry-0.1.0.schema.json": "sha256:7bd0a15770f2bae185600bd554198a791ab94dceb59b4d8084111d5bf01e6123",
    "schemas/hw/hw-sim-0.1.0.schema.json": "sha256:efa2591e203a56f9fe3792d0bbdd891ce3b3b01bab52e2976b11ad417bd35f6a",
    "schemas/hw/hw-t2-evidence-0.1.0.schema.json": "sha256:b5090bbe7b5a569c5f83d345b922a517a851824edd3fe2cad7f24ac42259a342"
  },
  "status": "pending",
  "tool_pins": {
    "fmpy": "0.3.24",
    "openmodelica": "1.24",
    "python": ">=3.10",
    "renode": "1.16"
  },
  "trace": {
    "artifact": "build/hw/t2_retention_001_trace.csv (per-run artifact, gitignored)",
    "columns": "time_us,vbat_mv,gpio_odr",
    "hashing": "sha256 of the trace CSV, measured invariants and measured tool versions recorded in build/hw/t2_retention_001.runlog.json"
  }
}
